{
  "date": "2026-08-21",
  "total": 5,
  "source": "2026-08-21.md",
  "questions": [
    {
      "id": "q1",
      "q": "2026年8月，广东启动防风Ⅳ级应急响应，其直接原因是：",
      "options": [
        "A. 台风“海高斯”登陆广东",
        "B. 今年第19号台风生成",
        "C. 广东进入汛期",
        "D. 强对流天气频发"
      ],
      "answer": 1,
      "analysis": "材料明确提到“今年第19号台风生成，广东启动防风Ⅳ级应急响应”，因此直接原因是台风生成。",
      "topic": "应急管理"
    },
    {
      "id": "q2",
      "q": "关于“大湾区‘菜篮子’产销对接信息平台”上线，下列说法正确的是：",
      "options": [
        "A. 该平台旨在促进大湾区农产品销售",
        "B. 该平台由农业农村部主导建设",
        "C. 该平台主要面向出口贸易",
        "D. 该平台上线时间在2025年"
      ],
      "answer": 0,
      "analysis": "材料提到“大湾区‘菜篮子’产销对接信息平台”正式上线，其核心功能是产销对接，促进销售，A项符合。其他选项材料未提及。",
      "topic": "区域发展"
    },
    {
      "id": "q3",
      "q": "江苏省纪念江泽民同志诞辰100周年座谈会举行，下列哪项表述正确？",
      "options": [
        "A. 座谈会由信长星主持",
        "B. 刘小涛出席并讲话",
        "C. 张义珍出席座谈会",
        "D. 座谈会于2026年8月21日举行"
      ],
      "answer": 2,
      "analysis": "材料明确“信长星讲话，刘小涛主持，张义珍出席”，因此张义珍出席正确。A项错误，信长星讲话而非主持；B项错误，刘小涛主持而非讲话；D项材料未提及具体日期。",
      "topic": "时政要闻"
    },
    {
      "id": "q4",
      "q": "成都大熊猫基地提示游客错峰游园，其依据是：",
      "options": [
        "A. 大熊猫喜凉怕热，晨起观赏最佳",
        "B. 大熊猫在午后活动频繁",
        "C. 夏季游客数量激增",
        "D. 基地需要闭园维护"
      ],
      "answer": 0,
      "analysis": "材料明确“熊猫喜凉怕热 晨起观赏最佳”，因此建议错峰游园。其他选项材料未提及。",
      "topic": "文旅"
    },
    {
      "id": "q5",
      "q": "关于乐山大佛“禁泳令”，材料指出其面临的问题是：",
      "options": [
        "A. 缺乏法律依据",
        "B. 执法不严",
        "C. 市民反对",
        "D. 管理成本高"
      ],
      "answer": 1,
      "analysis": "材料标题“有法可依，为何管不住人？”暗示有法可依但执法存在问题，B项符合。A项与“有法可依”矛盾；C、D项材料未提及。",
      "topic": "社会治理"
    }
  ]
}