{
  "date": "2026-08-16",
  "total": 3,
  "source": "2026-08-16.md",
  "questions": [
    {
      "id": "q1",
      "q": "《求是》杂志发表的习近平总书记重要文章标题是？",
      "options": [
        "A. 提高防灾减灾救灾能力",
        "B. 加强应急管理体系建设",
        "C. 推进国家治理体系和治理能力现代化",
        "D. 坚持人民至上生命至上"
      ],
      "answer": 0,
      "analysis": "材料明确提到《求是》杂志发表习近平总书记重要文章《提高防灾减灾救灾能力》，故选A。",
      "topic": "防灾减灾"
    },
    {
      "id": "q2",
      "q": "2026年开渔首日，哪个海事局完成了护航任务？",
      "options": [
        "A. 广东海事局",
        "B. 港珠澳大桥海事局",
        "C. 珠海海事局",
        "D. 珠江海事局"
      ],
      "answer": 1,
      "analysis": "材料中“港珠澳大桥海事局完成2026年开渔首日护航任务”直接对应B项。",
      "topic": "海事"
    },
    {
      "id": "q3",
      "q": "关于四川队在中国女子数学奥赛中的成绩，下列说法正确的是？",
      "options": [
        "A. 获得团体总分第二，3人直通CMO",
        "B. 获得团体总分第一，4人直通CMO",
        "C. 获得团体总分第一，5人直通CMO",
        "D. 获得团体总分第二，4人直通CMO"
      ],
      "answer": 1,
      "analysis": "材料指出“四川队拿下中国女子数学奥赛团体总分第一，4人直通CMO”，B项完全符合。",
      "topic": "教育"
    }
  ]
}