{
  "date": "2026-08-15",
  "total": 3,
  "source": "2026-08-15.md",
  "questions": [
    {
      "id": "q1",
      "q": "2026年8月15日，《求是》杂志发表习近平总书记的重要文章，其主题是：",
      "options": [
        "A. 提高防灾减灾救灾能力",
        "B. 推进生态文明建设",
        "C. 实施乡村振兴战略",
        "D. 加强科技创新引领"
      ],
      "answer": 0,
      "analysis": "材料首句明确提到《求是》杂志发表习近平总书记重要文章《提高防灾减灾救灾能力》，故选A。",
      "topic": "防灾减灾"
    },
    {
      "id": "q2",
      "q": "关于四川省资阳市卫健委辟谣事件，下列说法正确的是：",
      "options": [
        "A. 网传名单真实有效",
        "B. 网传名单系伪造，已报警",
        "C. 卫健委未回应此事",
        "D. 名单涉及公共卫生机构评级"
      ],
      "answer": 1,
      "analysis": "材料明确记载“资阳市卫健委紧急辟谣：网传‘2026年度公共卫生检测机构名单’系伪造，已报警”，故选B。",
      "topic": "公共安全"
    },
    {
      "id": "q3",
      "q": "江苏省为推进科技成果转化出台的政策文件是：",
      "options": [
        "A. 科技创新十条",
        "B. 成果转化20条",
        "C. 人才新政30条",
        "D. 产业升级15条"
      ],
      "answer": 1,
      "analysis": "材料提到“江苏出台‘成果转化20条’”，故选B。",
      "topic": "科技创新"
    }
  ]
}