{
  "date": "2026-08-12",
  "total": 3,
  "source": "2026-08-12.md",
  "questions": [
    {
      "id": "q1",
      "q": "根据材料，习近平就哥伦比亚地震向谁致慰问电？",
      "options": ["哥伦比亚总统", "联合国秘书长", "委内瑞拉总统", "智利总统"],
      "answer": 0,
      "analysis": "材料第一句明确：向哥伦比亚总统德拉埃斯普列亚致慰问电。",
      "topic": "外交"
    },
    {
      "id": "q2",
      "q": "「兰州拉面」改名「青海拉面」背后，青海省在力推什么战略？",
      "options": ["拉面产业品牌战略规划", "西部大开发战略", "乡村振兴战略", "对口援青战略"],
      "answer": 0,
      "analysis": "材料指出此次改名背后是青海省力推的拉面产业品牌战略规划。",
      "topic": "产业"
    },
    {
      "id": "q3",
      "q": "材料中河源水库实现「零伤亡」抢险的关键是什么？",
      "options": ["好制度配上尽责的人", "先进的救援设备", "充足的救灾资金", "及时的媒体报道"],
      "answer": 0,
      "analysis": "材料核心论点：好制度配上尽责的人，才能把预案落地。",
      "topic": "基层治理"
    }
  ]
}
