{
  "date": "2026-08-17",
  "total": 20,
  "source": "2026-08-17.md",
  "questions": [
    {
      "id": "q1",
      "q": "根据材料，朱镕基同志遗体火化当天，下列哪个场所不会下半旗志哀？",
      "options": [
        "首都天安门",
        "新华门",
        "各省区市党委和政府所在地",
        "国家体育场"
      ],
      "answer": 3,
      "analysis": "材料明确列出下半旗志哀的场所包括首都天安门、新华门、人民大会堂、外交部、各省区市党委和政府所在地、港澳特区、边境口岸、对外海空港口及中国驻外使领馆，不包括国家体育场。",
      "topic": "时政要闻"
    },
    {
      "id": "q2",
      "q": "关于朱镕基同志的职务，下列表述正确的是？",
      "options": [
        "中国共产党第十三届中央政治局常委",
        "国务院总理",
        "国家主席",
        "全国人大常委会委员长"
      ],
      "answer": 1,
      "analysis": "材料指出朱镕基同志是中国共产党第十四届、十五届中央政治局常委，国务院原总理，因此B正确。",
      "topic": "时政要闻"
    },
    {
      "id": "q3",
      "q": "习近平总书记强调，人工智能应该成为什么？",
      "options": [
        "少数国家的专利",
        "造福全人类的国际公共产品",
        "商业竞争的利器",
        "技术霸权的工具"
      ],
      "answer": 1,
      "analysis": "材料中习近平总书记指出“人工智能应该是造福全人类的国际公共产品”，故选B。",
      "topic": "人工智能"
    },
    {
      "id": "q4",
      "q": "根据材料，中国未来5年将面向发展中国家提供多少个人工智能专题研修培训名额？",
      "options": [
        "1000个",
        "3000个",
        "5000个",
        "10000个"
      ],
      "answer": 2,
      "analysis": "材料明确提到“未来5年，中国将面向发展中国家提供5000个人工智能专题研修培训名额”，故选C。",
      "topic": "人工智能"
    },
    {
      "id": "q5",
      "q": "下列哪个组织不是中国建设国际人工智能应用合作中心的对象？",
      "options": [
        "东盟",
        "阿盟",
        "非盟",
        "欧盟"
      ],
      "answer": 3,
      "analysis": "材料提到面向东盟、阿盟、非盟、拉共体、上合组织、金砖国家建设合作中心，不包括欧盟，故选D。",
      "topic": "人工智能"
    },
    {
      "id": "q6",
      "q": "根据材料，中国推动气象智能预警方案‘妈祖’在多少个国家落地应用？",
      "options": [
        "20个",
        "30个",
        "40个",
        "50个"
      ],
      "answer": 1,
      "analysis": "材料明确“推动气象智能预警方案‘妈祖’在30个国家落地应用”，故选B。",
      "topic": "人工智能"
    },
    {
      "id": "q7",
      "q": "江泽民生平和思想研讨会在京举行，蔡奇出席并讲话，他强调深化什么重要思想的研究？",
      "options": [
        "邓小平理论",
        "‘三个代表’重要思想",
        "科学发展观",
        "习近平新时代中国特色社会主义思想"
      ],
      "answer": 1,
      "analysis": "材料指出蔡奇强调深化“三个代表”重要思想研究，故选B。",
      "topic": "纪念活动"
    },
    {
      "id": "q8",
      "q": "根据材料，国务院第十二次全体会议指出当前经济形势的特点是什么？",
      "options": [
        "总体平稳、稳中有进，动能向新、结构向优",
        "下行压力加大，增速放缓",
        "通胀压力明显，物价上涨",
        "外部环境稳定，内需旺盛"
      ],
      "answer": 0,
      "analysis": "材料明确“我国经济运行总体平稳、稳中有进，呈现动能向新、结构向优的发展态势”，故选A。",
      "topic": "经济"
    },
    {
      "id": "q9",
      "q": "国务院第十二次全体会议提出，要坚持什么战略基点？",
      "options": [
        "扩大出口",
        "扩大内需",
        "扩大投资",
        "扩大消费"
      ],
      "answer": 1,
      "analysis": "材料强调“坚持扩大内需这个战略基点”，故选B。",
      "topic": "经济"
    },
    {
      "id": "q10",
      "q": "习近平在纪念江泽民同志诞辰100周年大会上的讲话中，号召学习江泽民同志的哪些方面？",
      "options": [
        "政治信仰、为民情怀、创新精神、战略思维、非凡胆略",
        "经济思想、军事才能、外交智慧、文化素养、个人魅力",
        "革命精神、斗争意志、朴素作风、严谨态度、奉献意识",
        "理论创新、实践创新、制度创新、文化创新、科技创新"
      ],
      "answer": 0,
      "analysis": "材料明确号召学习他坚定如磐的政治信仰、真挚深厚的为民情怀、与时俱进创新精神、深谋远虑战略思维、坚毅果敢的非凡胆略，故选A。",
      "topic": "纪念活动"
    },
    {
      "id": "q11",
      "q": "江泽民同志是哪一年加入中国共产党的？",
      "options": [
        "1945年",
        "1946年",
        "1947年",
        "1948年"
      ],
      "answer": 1,
      "analysis": "材料指出“1946年4月加入中国共产党”，故选B。",
      "topic": "纪念活动"
    },
    {
      "id": "q12",
      "q": "根据材料，福建“福海粮仓”主要指的是什么？",
      "options": [
        "粮食种植",
        "海洋渔业",
        "畜牧业",
        "林业"
      ],
      "answer": 1,
      "analysis": "材料主题是福建耕海牧渔，筑牢“福海粮仓”，指海洋渔业，故选B。",
      "topic": "乡村振兴"
    },
    {
      "id": "q13",
      "q": "今年前7月全国铁路完成固定资产投资多少亿元？",
      "options": [
        "4206亿元",
        "4406亿元",
        "4606亿元",
        "4806亿元"
      ],
      "answer": 1,
      "analysis": "材料明确“今年1至7月全国铁路完成固定资产投资4406亿元”，故选B。",
      "topic": "基础设施"
    },
    {
      "id": "q14",
      "q": "今年前7月全国铁路固定资产投资同比增长多少？",
      "options": [
        "1.5%",
        "1.8%",
        "2.0%",
        "2.5%"
      ],
      "answer": 1,
      "analysis": "材料明确“同比增长1.8%”，故选B。",
      "topic": "基础设施"
    },
    {
      "id": "q15",
      "q": "根据材料，家政服务业发展的方向是什么？",
      "options": [
        "规模化、品牌化、连锁化",
        "标准化、职业化、产业化",
        "专业化、精细化、高端化",
        "市场化、法治化、国际化"
      ],
      "answer": 1,
      "analysis": "材料明确“推动行业标准化、职业化、产业化发展”，故选B。",
      "topic": "民生"
    },
    {
      "id": "q16",
      "q": "国务院批复的《特殊教育发展提升“十五五”行动计划》要求加快建设什么样的特殊教育体系？",
      "options": [
        "规模化、标准化",
        "高质量、数字化、普惠化",
        "普及化、均衡化",
        "现代化、国际化"
      ],
      "answer": 1,
      "analysis": "材料明确“加快建设高质量特殊教育体系”“促进特殊教育数字化发展”“强化特殊教育普惠发展”，故选B。",
      "topic": "教育"
    },
    {
      "id": "q17",
      "q": "习近平就印尼地震向印尼总统致慰问电，他代表谁表示哀悼？",
      "options": [
        "中国共产党和中国人民",
        "中国政府和中国人民",
        "中国政府和中国共产党",
        "中国人民和世界人民"
      ],
      "answer": 1,
      "analysis": "材料明确“代表中国政府和中国人民，对遇难者表示哀悼”，故选B。",
      "topic": "外交"
    },
    {
      "id": "q18",
      "q": "根据材料，代理退保黑灰产中，中介机构可能涉嫌哪些犯罪？",
      "options": [
        "诈骗罪、盗窃罪",
        "敲诈勒索罪、诈骗罪、侵犯公民个人信息罪",
        "抢劫罪、绑架罪",
        "贪污罪、受贿罪"
      ],
      "answer": 1,
      "analysis": "材料明确“代理退保中介机构可能涉嫌敲诈勒索罪、诈骗罪、侵犯公民个人信息罪等”，故选B。",
      "topic": "金融安全"
    },
    {
      "id": "q19",
      "q": "根据材料，根除胃内幽门螺杆菌的唯一科学路径是什么？",
      "options": [
        "使用抗幽牙膏",
        "服用抗生素",
        "医生评估—分层诊疗—规范用药—停药4周复查",
        "口腔清洁"
      ],
      "answer": 2,
      "analysis": "材料明确“根除胃内Hp的唯一科学路径是：医生评估—分层诊疗—规范用药—停药4周复查”，故选C。",
      "topic": "健康"
    },
    {
      "id": "q20",
      "q": "根据材料，幽门螺杆菌的根除标准方案是什么？",
      "options": [
        "三联疗法",
        "铋剂四联疗法",
        "五联疗法",
        "单一抗生素"
      ],
      "answer": 1,
      "analysis": "材料明确“铋剂四联疗法是Hp根除的标准方案”，故选B。",
      "topic": "健康"
    }
  ]
}