{
  "date": "2026-08-19",
  "total": 4,
  "source": "2026-08-19.md",
  "questions": [
    {
      "id": "q1",
      "q": "2026年8月18日下午，国家主席习近平在北京同哪个国家的总统举行会谈？",
      "options": [
        "A. 阿根廷",
        "B. 厄瓜多尔",
        "C. 巴西",
        "D. 智利"
      ],
      "answer": 1,
      "analysis": "材料明确提到习近平同厄瓜多尔总统诺沃亚会谈，故选B。",
      "topic": "外交"
    },
    {
      "id": "q2",
      "q": "截至2026年，广东居民人均预期寿命是多少岁？",
      "options": [
        "A. 78.6岁",
        "B. 79.6岁",
        "C. 80.6岁",
        "D. 81.6岁"
      ],
      "answer": 2,
      "analysis": "材料指出广东居民人均预期寿命80.6岁，故选C。",
      "topic": "健康中国"
    },
    {
      "id": "q3",
      "q": "2026年，江苏光伏装机规模在全国率先突破多少千瓦？",
      "options": [
        "A. 五千万千瓦",
        "B. 八千万千瓦",
        "C. 一亿千瓦",
        "D. 一点二亿千瓦"
      ],
      "answer": 2,
      "analysis": "材料提到江苏光伏装机规模在全国率先破亿千瓦，故选C。",
      "topic": "能源"
    },
    {
      "id": "q4",
      "q": "2026年，哪位广东院士入选“最美医生”？",
      "options": [
        "A. 钟南山",
        "B. 侯凡凡",
        "C. 李兰娟",
        "D. 王辰"
      ],
      "answer": 1,
      "analysis": "材料明确提到75岁院士侯凡凡入选“最美医生”，故选B。",
      "topic": "医疗"
    }
  ]
}