{
  "date": "2026-08-20",
  "total": 5,
  "source": "2026-08-20.md",
  "questions": [
    {
      "id": "q1",
      "q": "关于流感疫苗接种，下列哪项说法是正确的？",
      "options": [
        "去年接种过流感疫苗，今年就不需要再接种了",
        "流感疫苗只能通过注射方式接种",
        "鼻喷流感疫苗不疼，且可以刷医保",
        "流感疫苗每年只需接种一次，无需重复接种"
      ],
      "answer": 2,
      "analysis": "材料中提到“鼻喷不疼还能刷医保”，说明鼻喷流感疫苗存在且可用医保，故选C。A、D与流感疫苗需每年接种的常识相悖，B过于绝对。",
      "topic": "健康中国"
    },
    {
      "id": "q2",
      "q": "广东省网络客运聚合平台的上线运行，主要实现了什么功能？",
      "options": [
        "提供城际客运出行“一键直达”服务",
        "取代所有传统客运方式",
        "仅服务于广东省内城市公交",
        "提供国际航班预订服务"
      ],
      "answer": 0,
      "analysis": "材料明确提到“城际客运出行可‘一键直达’”，故选A。B、C、D均无材料依据且不合逻辑。",
      "topic": "交通出行"
    },
    {
      "id": "q3",
      "q": "关于“奔县游”，下列哪项理解最符合材料主旨？",
      "options": [
        "“奔县游”是指游客盲目跟风前往县城旅游",
        "“奔县游”反映了县域旅游的兴起，具有发展潜力",
        "“奔县游”是城市居民逃离城市的表现",
        "“奔县游”导致县域环境恶化"
      ],
      "answer": 1,
      "analysis": "材料标题“奔县游何以有奔头”暗示其积极意义，故选B。A、C、D均属过度引申或负面推断，无材料依据。",
      "topic": "文旅融合"
    },
    {
      "id": "q4",
      "q": "关于发展现代农业，下列哪项措施与材料主题“多点发力助推乡村振兴”相符？",
      "options": [
        "单一依赖传统种植业",
        "仅依靠政策补贴",
        "多措并举，如科技支撑、产业融合等",
        "减少农业投入，保护环境"
      ],
      "answer": 2,
      "analysis": "材料标题强调“多点发力”，故选C。A、B、D均与“多点发力”不符，且无材料依据。",
      "topic": "乡村振兴"
    },
    {
      "id": "q5",
      "q": "关于“安静城市”建设，下列哪项说法符合材料主旨？",
      "options": [
        "“安静城市”是指城市完全无噪音",
        "“安静城市”旨在减少噪声污染，提升居民生活质量",
        "“安静城市”只针对夜间噪音",
        "“安静城市”建设会阻碍城市发展"
      ],
      "answer": 1,
      "analysis": "材料标题“安静城市托起安宁生活”表明其目的是提升生活安宁，故选B。A绝对化，C片面，D无依据。",
      "topic": "民生保障"
    }
  ]
}