{
  "date": "2026-08-18",
  "total": 5,
  "source": "2026-08-18.md",
  "questions": [
    {
      "id": "q1",
      "q": "国务院修改《住房公积金管理条例》的决定，其主要目的是什么？",
      "options": [
        "A. 取消住房公积金制度",
        "B. 优化住房公积金管理，保障职工权益",
        "C. 提高住房公积金贷款利率",
        "D. 限制住房公积金使用范围"
      ],
      "answer": 1,
      "analysis": "材料提到国务院关于修改《住房公积金管理条例》的决定，修改旨在优化管理，保障职工权益，而非取消或限制。",
      "topic": "住房政策"
    },
    {
      "id": "q2",
      "q": "关于我国首批数据领域国际合作试点，下列说法正确的是？",
      "options": [
        "A. 试点仅在广州开展",
        "B. 试点在深圳开展",
        "C. 试点在广州、深圳等地开展",
        "D. 试点在北京、上海开展"
      ],
      "answer": 2,
      "analysis": "材料明确提到“我国首批数据领域国际合作试点在广州、深圳等地开展”，故选C。",
      "topic": "数字经济"
    },
    {
      "id": "q3",
      "q": "2026年四川省“最美医务工作者”现场交流活动在哪个城市举行？",
      "options": [
        "A. 绵阳",
        "B. 成都",
        "C. 宜宾",
        "D. 泸州"
      ],
      "answer": 1,
      "analysis": "材料指出“2026年四川省‘最美医务工作者’现场交流活动在蓉举行”，蓉是成都的简称。",
      "topic": "医疗卫生"
    },
    {
      "id": "q4",
      "q": "江苏省财政下达“一事一议”奖补资金，主要用于支持什么？",
      "options": [
        "A. 大型基础设施建设",
        "B. 村级小型公益项目实施",
        "C. 城市绿化工程",
        "D. 工业项目发展"
      ],
      "answer": 1,
      "analysis": "材料明确提到“省财政下达‘一事一议’奖补资金 支持村级小型公益项目实施”，故选B。",
      "topic": "乡村振兴"
    },
    {
      "id": "q5",
      "q": "前7月广东省离境退税申请金额为多少？",
      "options": [
        "A. 16.9亿元",
        "B. 19.6亿元",
        "C. 61.9亿元",
        "D. 69.1亿元"
      ],
      "answer": 0,
      "analysis": "材料原文为“前7月广东省离境退税申请金额16.9亿元”，注意数字顺序，故选A。",
      "topic": "经济"
    }
  ]
}